Name,Context,Cleaned,Selective,Selective_Reduced,TF_Based
Backend Developer.docx,"Backend Developer - Python/Django



We are looking for Python/Django developers with 2-4 + years of experience to be part of our growing team. The role is of Python/Django Backend Web Developer who can handle the challenging work of Web applications development using Python / Django framework.

Required Skills:

Strong working knowledge of constructs of HTTP, RESTful APIs and WebSockets.

Build and maintain highly scalable Python processes for the purpose of data collection, manipulation, data pruning, trending and analytics, etc.

Strong understanding of Python and good knowledge of various Python Libraries (NumPy, Pandas, ORM libraries etc.), API's and toolkits

Able to integrate multiple data sources and databases into one system

Working knowledge of web templating engine for python such as Jinja2 etc

Ability to integrate user-facing elements developed by front-end developers with server-side logic.

Ability to integrate data storage solutions and caches.

Understanding of the threading limitations of Python, and multi-process architecture

Understanding of fundamental design principles behind a scalable application

Good understanding of event-driven programming in Python

Good knowledge of PostGRESQL

Able to create database schemas that represent and support business processes

Strong Analytical, Problem Solving & Innovative Skills.

Working knowledge of version control tools (GIT/SVN).

Experience/knowledge of working on the LINUX environment.

Attention to detail, problem-solver with strong analytical skill, good sense of urgency

Ability to carry out tasks without supervision and able to meet tight deadlines

Good Writing & Communication Skills. The candidate should be able to communicate with potential Clients and gather inputs/change requests.

Work with a performance oriented team driven by ownership and open to experiments

Strong interpersonal skills with excellent written and verbal communication

Responsibilities:

Develop back-end components to improve responsiveness and overall performance

Designing and implementing system architecture to handle scale

Coordinate with Frontend Dev team & Creating APIs (w/ DjangoRestFramework)

Integrating of web pages with Backend using templating engines for Python

Build bulletproof API integrations with third party APIs for various use cases

Good to have (Additional Skills):

Relevant full stack experience.

You've worked with core AWS services in the past and have experience with EC2, ELB, AutoScaling, CloudFront, S3

Demonstrable work/project portfolio online.

Working knowledge of front end technologies like Javascript, JQuery, HTML, and CSS

A good sense of design and aesthetics.

Experience/Zeal to work in a fast-paced startup environment.

Candidates who can join immediately will be preferredDevelop very high sense of ownership, the zeal to build scalable applications

Job Type: Full-time

Salary: ₹35,000.00 - ₹55,000.00 per month

Experience:

Django Development: 1 year (Preferred)

total work: 2 years (Preferred)

Education:

Bachelor's (Preferred)

Work Remotely:

Temporarily due to COVID-19",Backend Developer PythonDjango look PythonDjango developer year experience part grow team role PythonDjango Backend Web Developer handle challenge work web application development use Python Django framework Required Skills Strong work knowledge construct HTTP restful api WebSockets Build maintain highly scalable Python process purpose datum collection manipulation datum pruning trend analytic strong understand Python good knowledge various Python Libraries NumPy Pandas ORM librarie api toolkit able integrate multiple datum source database system Working knowledge web templating engine python Jinja2 Ability integrate userface element develop frontend developer serverside logic Ability integrate data storage solution cache understand threading limitation Python multiprocess architecture understand fundamental design principle scalable application good understanding eventdriven programming Python good knowledge PostGRESQL able create database schema represent support business process Strong Analytical Problem solve Innovative Skills Working knowledge version control tool GITSVN Experienceknowledge work LINUX environment Attention detail problemsolver strong analytical skill good sense urgency ability carry task supervision able meet tight deadline Good Writing Communication Skills candidate communicate potential client gather inputschange request work performance orient team drive ownership open experiment strong interpersonal skill excellent write verbal communication responsibility develop backend component improve responsiveness overall performance Designing implement system architecture handle scale Coordinate Frontend Dev team create api w DjangoRestFramework Integrating web page Backend use templating engine Python Build bulletproof api integration third party api various use case good Additional Skills Relevant full stack experience work core AWS service past experience EC2 ELB AutoScaling CloudFront S3 demonstrable workproject portfolio online Working knowledge front end technologie Javascript JQuery HTML css good sense design aesthetic ExperienceZeal work fastpace startup environment candidate join immediately preferreddevelop high sense ownership zeal build scalable application Job Type Fulltime Salary month Experience Django Development year preferred total work year Preferred Education Bachelors Preferred Work remotely temporarily due,HTML immediately due process Education orient templating potential Attention team request logic client element Designing overall solve Integrating problemsolver Jinja2 gather Developer full Development toolkit task grow limitation Innovative core online JQuery various party use css build engine implement join frontend remotely analytic eventdriven backend serverside high ELB Job framework improve Dev Preferred interpersonal role LINUX carry supervision DjangoRestFramework pruning Bachelors threading w end Type case Coordinate tight WebSockets responsiveness Working Relevant AutoScaling understand programming component meet AWS tool version ExperienceZeal application Backend Required manipulation open data communicate Ability preferred work Work integrate technologie part workproject NumPy GITSVN create handle skill Analytical able temporarily construct responsibility trend third past multiple verbal system control inputschange urgency Fulltime HTTP develop knowledge Good PythonDjango highly good environment Python write understanding preferreddevelop aesthetic Additional development principle experiment month Skills Django collection PostGRESQL look Experience candidate demonstrable source Strong ability Problem performance strong Writing scale schema analytical total represent startup web year Frontend fundamental design multiprocess integration business EC2 portfolio Communication storage ownership bulletproof ORM Salary librarie developer sense python fastpace support Experienceknowledge database challenge detail purpose Pandas deadline S3 Build front datum stack excellent CloudFront communication zeal Libraries Web userface drive Javascript restful api solution experience cache page maintain service architecture scalable,HTML process Education orient templating Attention team logic client element Designing solve Integrating problemsolver Jinja2 Developer Development toolkit task limitation Innovative core JQuery party use css build engine implement join serverside ELB Job framework Dev role LINUX supervision DjangoRestFramework pruning w end Type case Coordinate WebSockets responsiveness Working Relevant AutoScaling programming component AWS tool version ExperienceZeal application Backend Required manipulation Ability work Work part workproject NumPy GITSVN handle skill Analytical responsibility trend system control inputschange urgency Fulltime HTTP knowledge Good PythonDjango environment Python development principle experiment month Skills Django collection PostGRESQL Experience candidate source ability Problem performance Writing scale schema analytical total represent startup web year Frontend design multiprocess integration business EC2 portfolio Communication storage ownership bulletproof ORM Salary librarie developer sense python fastpace support Experienceknowledge database challenge detail purpose Pandas deadline S3 Build datum stack CloudFront communication zeal Web userface drive Javascript api solution experience cache page service architecture,ability able additional aesthetic analytic analytical api application architecture attention autoscaling aws bachelors backend build bulletproof business cache candidate carry case challenge client cloudfront collection communicate communication component construct control coordinate core create css data database datum deadline demonstrable design designing detail dev develop developer development django djangorestframework drive due ec2 education elb element end engine environment eventdriven excellent experience experienceknowledge experiencezeal experiment fastpace framework front frontend full fulltime fundamental gather gitsvn good grow handle high highly html http immediately implement improve innovative inputschange integrate integrating integration interpersonal javascript jinja2 job join jquery knowledge librarie libraries limitation linux logic look maintain manipulation meet month multiple multiprocess numpy online open orient orm overall ownership page pandas part party past performance portfolio postgresql potential preferred preferreddevelop principle problem problemsolver process programming pruning purpose python pythondjango relevant remotely represent request required responsibility responsiveness restful role s3 salary scalable scale schema sense serverside service skill skills solution solve source stack startup storage strong supervision support system task team technologie templating temporarily third threading tight tool toolkit total trend type understand understanding urgency use userface various verbal version web websockets work working workproject write writing year zeal
Billing cum Logistics Manager.docx,"Billing cum Logistics Manager

Job Summary
Urgent requirement of Billing cum Logistics Manager for Ecommerce Company
Locatio - Gurgaon
Company profile : detel-india.com
Responsibilities and Duties
Total Billing Monitor & Controlling
Invoice validation before sending to Customer with Accuracy
E-Commerce Billing, Monthly Fixed and Variable Billing.
Follow up & Clearance from Operation for specific Remarks in PODs (Shortages/Damages Etc)
Deductions booking off
Proper Documentation (Invoices/PODs Etc)
Reconciliation:
POD Reconciliation (Damages/Shortages/Other Remarks) & Resolution
Deductions Reconciliation & Recovery Preparation
Pending POD Controlling & Monitor",billing cum Logistics Manager Job Summary Urgent requirement Billing cum Logistics Manager Ecommerce Company Locatio Gurgaon Company profile detelindiacom Responsibilities Duties Total Billing Monitor control Invoice validation send Customer Accuracy ECommerce Billing monthly Fixed Variable Billing Follow Clearance Operation specific Remarks PODs ShortagesDamages Etc deduction book proper documentation invoicespods Etc Reconciliation POD Reconciliation DamagesShortagesOther Remarks Resolution Deductions Reconciliation Recovery Preparation pende POD Controlling Monitor,monthly Remarks DamagesShortagesOther Accuracy Job Follow Monitor Reconciliation billing Billing Clearance Summary control Variable Deductions ShortagesDamages documentation PODs Ecommerce POD Resolution Controlling Recovery deduction Locatio Logistics profile Fixed pende Customer specific Etc ECommerce invoicespods Urgent book Gurgaon detelindiacom Invoice send Manager Operation Duties requirement cum validation Preparation Responsibilities Total Company proper,Remarks DamagesShortagesOther Accuracy Job Follow Monitor Reconciliation billing Billing Clearance Summary control Variable ShortagesDamages documentation Ecommerce POD Resolution Controlling Recovery deduction Locatio Logistics profile pende Customer Etc ECommerce Urgent book Gurgaon detelindiacom Invoice Manager Operation requirement cum validation Preparation Total Company,accuracy billing book clearance company control controlling cum customer damagesshortagesother deduction deductions detelindiacom documentation duties ecommerce etc fixed follow gurgaon invoice invoicespods job locatio logistics manager monitor monthly operation pende pod pods preparation profile proper reconciliation recovery remarks requirement resolution responsibilities send shortagesdamages specific summary total urgent validation variable
Data Scientist.docx,"Data Scientist/ ML Engineer

Game Change Solutions

-

Gurgaon, Haryana

Temporarily remote

₹20,00,000 - ₹25,00,000 a year

We are looking for a data scientist that will help us discover the information hidden in vast amounts of data and help us make smarter decisions to deliver even better products. Your primary focus will be in applying data mining techniques, doing statistical analysis, and building high quality prediction systems integrated with our products. Data Scientist at GameChange must be an energetic self-starter who can quickly grasp the company’s vision, develop specific tactical plans, and begin implementation upon appropriate approvals. The candidate must be resourceful and able to deliver on a plan defined.

Responsibilities –

Data Crunching and data massaging on structured and unstructured data including Numerical, Text,

Audio and Video data

Implementation/fine-tuning of machine learning algorithms

Conducting Data science/machine learning experiments and presenting insights

Building innovative data products using cutting edge tools and technologies

Conduct data analysis independently or with limited supervision to generate business insights

Conduct diagnostic on the data to identify the improvement opportunities, design data-backed

performance improvement strategy, liaise with internal teams

Record keeping and data warehousing to enable Advanced Analytics operations for generating

meaningful business insights

Develop high quality client deliverables such as R models, Python scripts etc.

Skills required -

Excellent understanding of machine learning techniques and algorithms, such as k-NN, Naive Bayes,

SVM, Decision Forests, CNN, RNN, LSTM etc.

Experience with common data science toolkits, such as R, Weka, NumPy, OpenCV, MatLab, etc.

Great communication skills

Experience with data visualisation tools, such as D3.js, GGplot, etc.

Proficiency in using query languages such as SQL, Hive, Pig

Experience with NoSQL databases, such as MongoDB, Cassandra, HBase

Good applied statistics skills, such as distributions, statistical testing, regression, etc.

Good scripting and programming skills

Job Type: Full-time

Salary: ₹2,000,000.00 - ₹2,500,000.00 per year

Experience:

Data Science: 2 years (Preferred)

work: 1 year (Preferred)

Education:

Bachelor's (Preferred)",Data Scientist ML Engineer Game Change Solutions Gurgaon Haryana temporarily remote year look datum scientist help discover information hide vast amount datum help make smart decision deliver even well product primary focus apply datum mining technique statistical analysis build high quality prediction system integrate product Data Scientist GameChange energetic selfstarter quickly grasp company vision develop specific tactical plan begin implementation appropriate approval candidate resourceful able deliver plan define responsibility Data Crunching datum massage structure unstructured datum include Numerical Text Audio Video datum implementationfinetune machine learning algorithm Conducting Data sciencemachine learn experiment present insight build innovative data product use cut edge tool technology Conduct datum analysis independently limited supervision generate business insight conduct diagnostic datum identify improvement opportunity design databacked performance improvement strategy liaise internal team record keep datum warehousing enable Advanced Analytics operation generate meaningful business insight develop high quality client deliverable r model Python script Skills require excellent understand machine learn technique algorithm kNN Naive Bayes SVM Decision forest CNN RNN LSTM experience common datum science toolkit R Weka NumPy opencv MatLab great communication skill experience datum visualisation tool GGplot Proficiency use query language SQL Hive Pig Experience NoSQL database Cassandra HBase Good apply statistic skill distribution statistical testing regression good scripting programming skill Job Type Fulltime Salary year Experience Data Science year preferred work year Preferred Education Bachelors prefer,databacked technique Education edge Proficiency quickly enable Text team grasp make client model information even company analysis Solutions Advanced plan learn NoSQL statistic kNN Haryana Conduct toolkit Decision quality language deliverable resourceful liaise use build Video Scientist GameChange Audio HBase high Job prefer apply conduct Preferred define sciencemachine amount supervision ML remote Bachelors Science include Type selfstarter help script understand programming Weka forest tool machine Analytics great regression Gurgaon unstructured MatLab R data improvement preferred work Game integrate SVM scientist NumPy learning skill primary able opencv temporarily query algorithm responsibility record Pig Conducting cut vision system generate insight tactical SQL implementation Fulltime product develop visualisation Good good Python require Data diagnostic implementationfinetune experiment Skills Hive look discover Experience Engineer candidate r warehousing performance RNN internal meaningful prediction Change independently distribution year opportunity design operation statistical Naive business science structure testing scripting massage hide Salary technology Crunching LSTM smart database Cassandra deliver appropriate innovative keep focus begin Bayes datum energetic present well GGplot specific mining excellent decision CNN Numerical communication strategy vast approval common experience identify limited,technique Education edge Proficiency Text team grasp client model information company analysis Advanced plan NoSQL Haryana Conduct toolkit Decision quality language liaise use Video Scientist GameChange Audio HBase Job prefer define sciencemachine amount supervision ML Bachelors Science Type selfstarter script Weka forest tool machine regression Gurgaon MatLab R improvement work Game SVM scientist NumPy learning skill primary opencv query algorithm responsibility record Pig Conducting vision system insight SQL implementation Fulltime product visualisation Python Data implementationfinetune experiment Skills Hive look discover Experience Engineer candidate r warehousing performance RNN prediction Change distribution year opportunity design operation business science structure scripting massage Salary technology Crunching LSTM database Cassandra keep focus Bayes GGplot mining decision CNN communication strategy approval experience,able advanced algorithm amount analysis analytics apply appropriate approval audio bachelors bayes begin build business candidate cassandra change client cnn common communication company conduct conducting crunching cut data databacked database datum decision define deliver deliverable design develop diagnostic discover distribution edge education enable energetic engineer even excellent experience experiment focus forest fulltime game gamechange generate ggplot good grasp great gurgaon haryana hbase help hide high hive identify implementation implementationfinetune improvement include independently information innovative insight integrate internal job keep knn language learn learning liaise limited look lstm machine make massage matlab meaningful mining ml model naive nosql numerical numpy opencv operation opportunity performance pig plan prediction prefer preferred present primary product proficiency programming python quality query quickly record regression remote require resourceful responsibility rnn salary science sciencemachine scientist script scripting selfstarter skill skills smart solutions specific sql statistic statistical strategy structure supervision svm system tactical team technique technology temporarily testing text tool toolkit type understand unstructured use vast video vision visualisation warehousing weka well work year
