Name,Context,Cleaned,Selective,Selective_Reduced,TF_Based
Primary English Teacher.docx,"Primary English Teacher

Position Title: Facilitator for fREADom Live Classes
Department: fREADom Mobile App
Working with: Consumer App Team
Location: comfort of your own home!

About Stones2Milestones
Stones2Milestones is on a mission to 'Create a Nation of Readers', gifting children the will and skill to read in English. We have created India’s most premier reading program for children of ages 3-9 and are currently impacting over 200,000 children in 110 schools across 50+ cities.
A significant part of this reading program is the fREADom mobile app. The award-winning app, which parents and children use at home to bond over reading, has over 1500 stories, activities and news pieces for children to read and enjoy.
The team believes that by helping children to 'Learn to Read' in elementary years, they enable them to 'Read to Learn' during formal education and eventually 'Read to Lead' in their chosen paths, helping them find their place in the world. Today, we are leveraging our technology platforms to grow our mission across three axes- age, geography and stakeholders.
Position, Purpose and Key Responsibilities:
We are looking to bring into our fold an incredible teacher/facilitator to conduct online classes for children of ages 6-10. These classes will be on topics related to phonics, vocabulary, comprehension, conversational English, storytelling and writing. They will be conducted via a video calling technology interface. Each class will be 45-60 minutes long. All the material you need to conduct the class will be provided.
This is a monthly retainership role. You will not be a full time employee of the company unless offered otherwise. The classes will happen between 3 pm - 8 pm.
Key Responsibilities:

Conducting excellent and engaging live classes for children:

Conducting a minimum of 12 classes a week and maximum of 20 classes in a week in a way that children are able to meet their learning outcomes.

Improving constantly:

Working relentlessly to improve the children’s class experience and own knowledge of facilitation, pedagogy and technology. Accept feedback and give the Stones2Milestones team constructive feedback on the classes, topic flow and resources as well.

Adhering to administrative needs for all classes:

Ensuring marking of attendance, correction of children’s homework and keeping all documentation up to date.
Necessary prerequisites - skills

Excellent communicative and written English

Teaching experience (online or in a classroom)

Ease of using or ability to learn and grasp technology like email, Google Slides and Google Sheets

Necessary prerequisites - technology

Strong, fully functioning and hi-speed Internet connection

A good laptop or tablet, functioning webcam, good speaker

A good smartphone

Remuneration:
(A) Skills, abilities and attitudes:

Support of a great network of facilitators

Opportunities for pedagogical development

Ability to spend time with children who love and adore you, look forward to pleasing you

(b) Monetary:

2 classes/day - 11k/month

3 classes/day - 17k/month

Job Types: Full-time, Contract

Experience:

work: 1 year (Preferred)

total work: 1 year (Preferred)

Education:

Bachelor's (Preferred)",primary English teacher Position Title Facilitator fREADom Live Classes Department fREADom Mobile App Working Consumer App Team Location comfort home Stones2Milestones Stones2Milestones mission Create Nation reader gift child skill read English create Indias premier reading program child age currently impact child school city significant part read program fREADom mobile app awardwinne app parent child use home bond reading story activity news piece child read enjoy team believe help child Learn Read elementary year enable Read Learn formal education eventually Read Lead choose path find place world today leverage technology platform grow mission axis age geography stakeholder Position Purpose Key responsibility bring fold incredible teacherfacilitator conduct online class child age class topic relate phonic vocabulary comprehension conversational english storytelling writing conduct video call technology interface class minute long material need conduct class provide monthly retainership role full time employee company offer otherwise class happen pm pm Key Responsibilities conduct excellent engage live class child conduct minimum class week maximum class week way child able learn outcome improve constantly Working relentlessly improve children class experience knowledge facilitation pedagogy technology accept feedback give stones2milestone team constructive feedback class topic flow resource well adhere administrative need class ensure mark attendance correction children homework keep documentation date necessary prerequisite skill excellent communicative write English Teaching experience online classroom Ease use ability learn grasp technology email Google Slides Google Sheets necessary prerequisite technology Strong fully function hispeed internet connection good laptop tablet function webcam good speaker good smartphone Remuneration A Skills ability attitude support great network facilitator Opportunities pedagogical development Ability spend time child love adore look forward pleasing Monetary classesday 11kmonth classesday Job Types Fulltime Contract Experience work year preferred total work year Preferred Education Bachelors prefer,monthly Classes constructive Education forward fully enable English team grasp connection outcome attitude find child company Sheets learn speaker children retainership function gift full communicative Remuneration writing give Monetary week Teaching grow love online Nation minute smartphone world facilitation homework axis use Facilitator Live Create need accept spend pedagogy ensure activity Job improve prefer conduct prerequisite Preferred believe premier constantly comfort Consumer parent role comprehension otherwise maximum pedagogical way topic pm Bachelors Google correction english video interface date help Working administrative webcam class engage mission time great program A Department piece adhere significant education feedback mark minimum relate conversational internet geography App Ability city offer work preferred part news necessary create skill primary able flow responsibility classroom app Position bring happen attendance live documentation elementary Fulltime today stones2milestone Team Lead incredible knowledge good adore write resource classesday development reader Skills Indias look formal relentlessly Experience facilitator ability email material Strong age platform eventually Responsibilities path total enjoy home reading year Purpose fold Stones2Milestones storytelling pleasing fREADom place impact technology provide support Learn vocabulary 11kmonth hispeed choose Mobile network Slides school awardwinne Title keep story currently Location tablet Ease well mobile excellent phonic stakeholder teacherfacilitator Types Contract teacher read Key call experience laptop Read leverage long bond Opportunities employee,Education team grasp connection outcome attitude child company speaker function gift Remuneration writing Monetary week Teaching Nation minute smartphone world facilitation homework axis Facilitator Live Create need pedagogy ensure activity Job conduct prerequisite Preferred believe premier Consumer parent role comprehension way topic pm Bachelors Google correction english video interface date webcam class engage mission time program Department piece education feedback mark minimum internet geography App Ability city offer work part news create skill flow responsibility classroom app Position attendance documentation Fulltime today stones2milestone Team Lead knowledge good adore resource classesday development reader Skills facilitator ability email material age platform total home reading year Purpose fREADom place impact technology support Learn vocabulary 11kmonth hispeed Mobile network Slides school awardwinne Title story Location tablet Ease phonic stakeholder teacherfacilitator Types Contract teacher call experience laptop Read leverage bond employee,11kmonth ability able accept activity adhere administrative adore age app attendance attitude awardwinne axis bachelors believe bond bring call child children choose city class classes classesday classroom comfort communicative company comprehension conduct connection constantly constructive consumer contract conversational correction create currently date department development documentation ease education elementary email employee enable engage english enjoy ensure eventually excellent experience facilitation facilitator feedback find flow fold formal forward freadom full fulltime fully function geography gift give good google grasp great grow happen help hispeed home homework impact improve incredible indias interface internet job keep key knowledge laptop lead learn leverage live location long look love mark material maximum minimum minute mission mobile monetary monthly nation necessary need network news offer online opportunities otherwise outcome parent part path pedagogical pedagogy phonic piece place platform pleasing pm position prefer preferred premier prerequisite primary program provide purpose read reader reading relate relentlessly remuneration resource responsibilities responsibility retainership role school sheets significant skill skills slides smartphone speaker spend stakeholder stones2milestone stones2milestones story storytelling strong support tablet teacher teacherfacilitator teaching team technology time title today topic total types use video vocabulary way webcam week well work working world write writing year
Revenue Reporting Data Analyst.docx,"Revenue Reporting Data Analyst, Business Finance Accounting



Minimum qualifications:



Bachelor's degree in Accounting, Finance, Business, Engineering or Data Science or equivalent practical experience.

4 years of relevant work experience.

Database experience including SQL coding across standard commercial databases or equivalent in other programming languages.

Experience with standard finance systems (e.g. Oracle, Hyperion, OBIEE, SAP) and core finance processes.

Preferred qualifications:



Experience driving operational process improvement.

Experience developing and analyzing large, complex data sets and converting them into information/insights that drive business decisions at all levels of the organization.

Ability to multi-task and apply initiative and creativity on challenging projects.

Distinctive problem-solving and analytical skills combined with strong business acumen.

Exemplary customer service and tactful communication skills, both spoken and written.

Exceptional analytical and technical problem solving skills.

About the job

Analysts on the Business Finance and Accounting Systems team collaborate with multiple teams to ensure that we have robust, scalable data and reporting processes to support our business partners to deliver on internal and external data requests.



As a Revenue Reporting Data Analyst, you will be focused on executing on internal and external data and reporting requests, including implementing opportunities to optimize our reporting data infrastructure. You will work well with other teams, provide outstanding customer service, deliver on deadlines, and produce flawless work. This role will partner with our Accounting Operations, Tax, External Reporting and Legal teams to provide timely data to manage financial risk, educate users on Google’s revenue data sets and drive efficiency improvements, ensuring that partners can adhere to regulatory requirements. You will also work closely with these teams to develop scalable data solutions for accounting and reporting processes.



Responsibilities

Work with cross-functional departments on reporting data and system initiatives.

Utilize SQL coding to provide financial data for internal and external financial reporting.

Critically evaluate data gathered from multiple sources, identify gaps, reconcile conflicts and decompose high-level information into details to drive decision-making.

Partner with internal teams to define and implement data solutions that improve accounting and reporting processes and architect innovative data solutions to automate and scale revenue reporting.

Maintain highest levels of development practices including technical design, solution development, systems configuration, test documentation/execution, issue identification and resolution, and writing clean, modular and self-sustaining code.",revenue Reporting Data Analyst Business Finance Accounting Minimum qualification Bachelors degree Accounting Finance Business Engineering Data Science equivalent practical experience year relevant work experience Database experience include SQL code standard commercial database equivalent programming language experience standard finance systems eg Oracle Hyperion OBIEE SAP core finance process preferred qualification experience drive operational process improvement experience develop analyze large complex data set convert informationinsight drive business decision level organization Ability multitask apply initiative creativity challenge project distinctive problemsolve analytical skill combine strong business acuman exemplary customer service tactful communication skill speak write Exceptional analytical technical problem solve skill job Analysts Business Finance Accounting Systems team collaborate multiple team ensure robust scalable datum reporting process support business partner deliver internal external datum request Revenue Reporting Data Analyst focus execute internal external datum reporting request include implement opportunity optimize report datum infrastructure work well team provide outstanding customer service deliver deadline produce flawless work role partner Accounting Operations Tax External report legal team provide timely datum manage financial risk educate user Googles revenue data set drive efficiency improvement ensure partner adhere regulatory requirement also work closely team develop scalable data solution accounting reporting process Responsibilities work crossfunctional department report datum system initiative Utilize SQL coding provide financial datum internal external financial reporting critically evaluate datum gather multiple source identify gap reconcile conflict decompose highlevel information detail drive decisionmake Partner internal team define implement data solution improve accounting reporting process architect innovative data solution automate scale revenue report maintain high level development practice include technical design solution development system configuration test documentationexecution issue identification resolution write clean modular selfsustaine code,multitask speak also process Analysts Revenue informationinsight OBIEE Systems problem team financial request Engineering Database flawless information Minimum automate external External Hyperion solve regulatory practical gather initiative reporting technical decisionmake architect core language combine analyze problemsolve eg requirement commercial implement department level collaborate Exceptional resolution ensure high improve apply Analyst define report role job Bachelors Science include exemplary equivalent creativity user evaluate tactful identification programming legal adhere issue partner data improvement Ability preferred Accounting work critically optimize accounting reconcile test large skill complex documentationexecution qualification multiple operational selfsustaine Finance project system SQL organization robust risk develop SAP write systems outstanding timely Data Googles development conflict set coding degree convert efficiency highlevel source strong customer execute internal scale Oracle analytical Responsibilities Reporting Utilize code year opportunity design business practice configuration educate gap Business support provide produce database infrastructure deliver challenge detail Partner innovative relevant revenue deadline focus datum Tax decompose acuman well clean modular decision communication finance crossfunctional drive Operations manage solution experience identify maintain distinctive service standard closely scalable,multitask speak Revenue OBIEE problem team request Engineering Database flawless information Minimum automate External Hyperion gather initiative decisionmake architect core language combine analyze problemsolve eg requirement commercial implement department level collaborate Exceptional resolution improve Analyst define report role job Bachelors Science creativity user identification programming adhere issue partner improvement Ability Accounting work accounting test skill documentationexecution qualification selfsustaine Finance project system SQL organization risk SAP write timely Data Googles development conflict degree convert efficiency highlevel source customer scale Oracle Utilize code year opportunity design business practice configuration educate gap Business support produce database infrastructure challenge detail Partner revenue deadline focus datum Tax decompose acuman decision communication finance drive solution experience service standard,ability accounting acuman adhere also analyst analysts analytical analyze apply architect automate bachelors business challenge clean closely code coding collaborate combine commercial communication complex configuration conflict convert core creativity critically crossfunctional customer data database datum deadline decision decisionmake decompose define degree deliver department design detail develop development distinctive documentationexecution drive educate efficiency eg engineering ensure equivalent evaluate exceptional execute exemplary experience external finance financial flawless focus gap gather googles high highlevel hyperion identification identify implement improve improvement include information informationinsight infrastructure initiative innovative internal issue job language large legal level maintain manage minimum modular multiple multitask obiee operational operations opportunity optimize oracle organization outstanding partner practical practice preferred problem problemsolve process produce programming project provide qualification reconcile regulatory relevant report reporting request requirement resolution responsibilities revenue risk robust role sap scalable scale science selfsustaine service set skill solution solve source speak sql standard strong support system systems tactful tax team technical test timely user utilize well work write year
