Name,Context,Cleaned,Selective,Selective_Reduced,TF_Based
IT Project Manager.docx,"IT Project Manager

Roles and Responsibilities

Accomplishes information technology staff results by communicating job expectations; planning, monitoring, and appraising job results; coaching, counseling, and disciplining employees; initiating, coordinating, and enforcing systems, policies, and procedures.

Maintains staff by recruiting, selecting, orienting, and training employees; maintaining a safe and secure work environment; developing personal growth opportunities.

Maintains organization's effectiveness and efficiency by defining, delivering, and supporting strategic plans for implementing information technologies.

Directs technological research by studying organization goals, strategies, practices, and user projects.

Completes projects by coordinating resources and timetables with user departments and data center.

Verifies application results by conducting system audits of technologies implemented.

Preserves assets by implementing disaster recovery and back-up procedures and information security and control structures.

Recommends information technology strategies, policies, and procedures by evaluating organization outcomes; identifying problems; evaluating trends; anticipating requirements.

Accomplishes financial objectives by forecasting requirements; preparing an annual budget; scheduling expenditures; analyzing variances; initiating corrective action.

Maintains quality service by establishing and enforcing organization standards.

Maintains professional and technical knowledge by attending educational workshops; reviewing professional publications; establishing personal networks; benchmarking state-of-the-art practices; participating in professional societies.

Contributes to team effort by accomplishing related results as needed.

Desired Candidate Profile

Qualification:

B.e/B.tech/MCA/Msc/M.e-IT/Computer science

Experience: Minimum 1 year as project manager",IT Project Manager Roles Responsibilities accomplish information technology staff result communicate job expectation plan monitoring appraise job result coach counsel discipline employee initiate coordinate enforce system policy procedure Maintains staff recruit select orienting training employee maintain safe secure work environment develop personal growth opportunity maintain organization effectiveness efficiency define deliver support strategic plan implement information technology direct technological research study organization goal strategy practice user project Completes project coordinate resource timetable user departments data center Verifies application result conduct system audits technology implement Preserves asset implement disaster recovery backup procedure information security control structure recommend information technology strategy policy procedure evaluate organization outcome identify problem evaluate trend anticipate requirement accomplish financial objective forecasting requirement prepare annual budget scheduling expenditure analyze variance initiate corrective action maintain quality service establish enforce organization standard maintain professional technical knowledge attend educational workshop review professional publication establish personal network benchmarke stateoftheart practice participate professional society contribute team effort accomplish related result need desire Candidate Profile Qualification BeBtechMCAMscMeITComputer science experience Minimum year project manager,expectation personal recruit problem team outcome financial study timetable information audits departments Minimum workshop desire plan forecasting technical quality discipline analyze publication requirement need implement disaster growth review Preserves policy conduct define job participate stateoftheart user expenditure evaluate Roles budget training attend application secure strategic scheduling orienting data Manager communicate work related appraise center Profile standard enforce Maintains establish trend society anticipate effectiveness system project IT coordinate accomplish backup control recommend benchmarke organization direct Candidate develop knowledge environment resource technological effort staff initiate efficiency result corrective Project procedure select asset monitoring BeBtechMCAMscMeITComputer recovery manager Qualification Responsibilities opportunity year practice science structure safe educational technology objective contribute support network deliver Completes annual action research security prepare strategy Verifies counsel experience professional coach identify maintain goal variance service employee,expectation recruit problem team study timetable information audits Minimum workshop desire plan quality discipline analyze publication requirement disaster growth review policy conduct define job participate user expenditure evaluate budget training attend application scheduling orienting Manager work center Profile enforce trend society effectiveness system project backup control benchmarke organization Candidate knowledge environment resource effort staff initiate efficiency Project procedure asset BeBtechMCAMscMeITComputer recovery manager Qualification opportunity year practice science structure technology contribute support network action research security prepare strategy counsel coach goal variance service employee,accomplish action analyze annual anticipate application appraise asset attend audits backup bebtechmcamscmeitcomputer benchmarke budget candidate center coach communicate completes conduct contribute control coordinate corrective counsel data define deliver departments desire develop direct disaster discipline educational effectiveness efficiency effort employee enforce environment establish evaluate expectation expenditure experience financial forecasting goal growth identify implement information initiate it job knowledge maintain maintains manager minimum monitoring need network objective opportunity organization orienting outcome participate personal plan policy practice prepare preserves problem procedure professional profile project publication qualification quality recommend recovery recruit related requirement research resource responsibilities result review roles safe scheduling science secure security select service society staff standard stateoftheart strategic strategy structure study support system team technical technological technology timetable training trend user variance verifies work workshop year
Lead Technical Program Manager.docx,"Lead Technical Program Manager, Site Reliability Engineering

Minimum qualifications:



Bachelor's degree in Computer Science, a related technical field or equivalent practical experience.

Experience managing end-to-end lifecycle of technical projects.

Experience with Unix/Linux systems with scripting experience in Shell, Perl or Python.

Experience in one or more of the following: C, C++, Java, Python.

Preferred qualifications:



Program management or technical management experience leading large-scale, cross-functional, and dynamic technical projects.

Software engineering management or project management expertise.

Ability to define strategic goals and organize a team and their services around delivering on those goals.

Leadership skills and a passion for growing and building an effective TPM function within an SRE organization.

Excellent communication skills, with ability to articulate your thoughts clearly and communicate across a wide variety of functions (SRE, Engineering) and levels.

About the job

Google's projects, like our users, span the globe and require managers to keep the big picture in focus while being able to dive into the unique engineering challenges we face daily. As a Technical Program Manager at Google, you lead complex, multi-disciplinary engineering projects using your engineering expertise. You plan requirements with internal customers and usher projects through the entire project lifecycle. This includes managing project schedules, identifying risks and clearly communicating them to project stakeholders. You're equally at home explaining your team's analyses and recommendations to executives as you are discussing the technical trade-offs in product development with engineers.



In this role you will manage a group of Technical Program Managers (TPMs) working across a multitude of product groups who manage complex programs. The TPM role in SRE is at the core of preparing for the continued exponential growth of Google and other programs in Technical Infrastructure. TPMs play a pivotal role in ensuring that Google services/infrastructure are carefully planned and deployed in a time, place, and configuration which is ideal for serving Google's users. Your role sits at a nexus of capacity planning, technical project execution, product planning, site reliability and software engineering.



Your leadership abilities will be drawn upon to assist the TPM function in delivering large, highly complex and cross-functional programs. You will be equally at home explaining analyses and project recommendations to executives as you are discussing the technical merits of next-generation architectures with engineers, or building tools to automate and scale their impact.



Behind everything our users see online is the architecture built by the Technical Infrastructure team to keep it running. From developing and maintaining our data centers to building the next generation of Google platforms, we make Google's product portfolio possible. We're proud to be our engineers' engineers and love voiding warranties by taking things apart so we can rebuild them. We keep our networks up and running, ensuring our users have the best and fastest experience possible.



Responsibilities

Manage a team of TPMs working across all core networking groups and assist where necessary to ensure successful delivery of multiple programs concurrently. 

Assist Director on operational management of Product Area.

Collaborate with SRE leadership in key program decision making - including scope definition, requirements gathering, staffing, planning and execution of programs. 

Work with cross-functional partners and manage the intake of work into teams in a process and scalable driven fashion. 

Be responsible for the people and career development of TPMs and working to identify opportunities for exciting career challenges. Ensure there is flexibility and mobility opportunities also.",Lead Technical Program Manager Site Reliability Engineering Minimum qualification Bachelors degree Computer Science relate technical field equivalent practical experience experience manage endtoend lifecycle technical project Experience UnixLinux system scripting experience Shell Perl Python experience follow C C Java Python Preferred qualification Program management technical management experience lead largescale crossfunctional dynamic technical project Software engineering management project management expertise ability define strategic goal organize team service deliver goal Leadership skill passion grow building effective TPM function SRE organization Excellent communication skill ability articulate thought clearly communicate wide variety function SRE Engineering level job Googles project user span globe require manager keep big picture focus able dive unique engineering challenge face daily Technical Program Manager Google lead complex multidisciplinary engineering project use engineering expertise plan requirement internal customer usher project entire project lifecycle include manage project schedule identify risk clearly communicate project stakeholder re equally home explain team analyse recommendation executive discuss technical tradeoff product development engineer role manage group Technical Program Managers tpm work multitude product group manage complex program TPM role SRE core prepare continue exponential growth Google program Technical Infrastructure tpm play pivotal role ensure Google servicesinfrastructure carefully plan deploy time place configuration ideal serve Googles user role sit nexus capacity plan technical project execution product planning site reliability software engineering leadership ability draw assist TPM function deliver large highly complex crossfunctional program equally home explain analyses project recommendation executive discuss technical merit nextgeneration architecture engineer build tool automate scale impact user see online architecture build Technical Infrastructure team keep run develop maintain data center build next generation Google platform make Googles product portfolio possible proud engineer engineer love void warranty take thing apart rebuild keep network run ensure user well fast experience possible Responsibilities Manage team tpm work core networking group assist necessary ensure successful delivery multiple program concurrently assist Director operational management Product Area Collaborate SRE leadership key program decision making include scope definition requirement gather staffing planning execution program work crossfunctional partner manage intake work team process scalable drive fashion responsible people career development tpm work identify opportunity exciting career challenge ensure flexibility mobility opportunity also,play planning multidisciplinary Managers re also process Site servicesinfrastructure endtoend team dynamic C Perl Engineering make dive fast Minimum software Infrastructure automate delivery draw plan run schedule practical function continue gather technical management tpm grow variety core exponential leadership love online take Product globe Manage Program use requirement warranty build field explain Reliability tradeoff intake organize level entire reliability possible definition ensure assist Area growth clearly passion Preferred define role job SRE span picture scope Bachelors Science site Google include Java recommendation unique equivalent engineering user thought Excellent carefully void staffing mobility nexus analyse time tool program making Leadership strategic expertise usher partner daily engineer data career Manager relate communicate work next lifecycle execution merit large necessary skill center complex able Technical people qualification TPM multiple thing operational system project largescale organization risk product develop proud Lead effective serve highly responsible Python require Googles development degree key UnixLinux Experience flexibility nextgeneration Shell ability big sit networking executive manager customer discuss platform internal scale Collaborate apart Responsibilities lead home deploy articulate follow opportunity scripting configuration portfolio rebuild place impact capacity concurrently building pivotal successful analyses network deliver challenge Director multitude keep see focus group ideal Computer Software well decision face prepare stakeholder crossfunctional communication equally wide manage drive generation experience identify maintain goal service exciting architecture fashion scalable,planning multidisciplinary Site servicesinfrastructure team C Perl Engineering software Infrastructure automate delivery draw plan schedule function management tpm variety core leadership love Product globe Manage Program use requirement warranty build field Reliability tradeoff intake organize level reliability definition Area growth define role job SRE span picture scope Bachelors Science site Google Java recommendation engineering user Excellent staffing mobility nexus analyse time tool program Leadership expertise partner engineer data career Manager work lifecycle execution merit skill center complex TPM thing system project largescale organization risk product Lead Python Googles development degree UnixLinux Experience flexibility nextgeneration Shell ability networking manager customer platform scale Collaborate follow opportunity configuration portfolio place impact capacity network challenge Director multitude focus group ideal Computer Software decision face stakeholder communication drive generation experience goal service architecture fashion,ability able also analyse analyses apart architecture area articulate assist automate bachelors big build building capacity career carefully center challenge clearly collaborate communicate communication complex computer concurrently configuration continue core crossfunctional customer daily data decision define definition degree deliver delivery deploy develop development director discuss dive draw drive dynamic effective endtoend engineer engineering ensure entire equally equivalent excellent exciting execution executive experience expertise explain exponential face fashion fast field flexibility focus follow function gather generation globe goal google googles group grow growth highly home ideal identify impact include infrastructure intake internal java job keep key large largescale lead leadership level lifecycle love maintain make making manage management manager managers merit minimum mobility multidisciplinary multiple multitude necessary network networking next nextgeneration nexus online operational opportunity organization organize partner passion people perl picture pivotal place plan planning platform play portfolio possible practical preferred prepare process product program project proud python qualification re rebuild recommendation relate reliability require requirement responsibilities responsible risk role run scalable scale schedule science scope scripting see serve service servicesinfrastructure shell sit site skill software span sre staffing stakeholder strategic successful system take team technical thing thought time tool tpm tradeoff unique unixlinux use user usher variety void warranty well wide work
